{
  "$schema": "https://json-schema.org/draft/2020-12/schema",
  "$id": "https://tinywms.local/schemas/inventory.schema.json",
  "title": "TinyWMS Inventory",
  "type": "array",
  "items": {
    "type": "object",
    "additionalProperties": false,
    "required": ["sku", "description", "bin_location", "quantity", "unit"],
    "properties": {
      "sku": { "type": "string", "minLength": 1 },
      "description": { "type": "string", "minLength": 1 },
      "bin_location": { "type": "string", "minLength": 1 },
      "quantity": { "type": "integer", "minimum": 0 },
      "unit": { "type": "string", "minLength": 1 }
    }
  }
}
